{
  "$schema": "https://json-schema.org/draft/2020-12/schema",
  "$id": "lma:configuration/meeting_consent",
  "title": "Meeting consent",
  "description": "Whether participants are told that a meeting is recorded and transcribed, and whether their consent is needed first. This is the deployment's default; a meeting can be started with a different choice unless that is turned off below. What LMA records is supporting evidence of what participants said, not a legal determination of consent; see the Meeting Consent documentation.",
  "sectionLabel": "Meeting Consent",
  "appliesText": "A saved change applies to meetings whose consent starts after the save; a meeting already under way keeps the mode and rule it started with.",
  "order": 12,
  "collapsible": true,
  "defaultExpanded": false,
  "mergeStrategy": "merge",
  "type": "object",
  "properties": {
    "mode": {
      "order": 0,
      "type": "string",
      "title": "Consent mode",
      "description": "Off: no notice. Notify: a notice is posted and the meeting is recorded and transcribed unless a participant objects, which stops it. Opt-in: a request is posted and nothing is recorded or transcribed until the consent rule below is met; an objection stops it again.",
      "enum": ["off", "notify", "opt_in"],
      "enumLabels": {
        "off": "Off",
        "notify": "Notify (participants may object)",
        "opt_in": "Opt-in (consent needed first)"
      }
    },
    "consentRule": {
      "order": 1,
      "type": "string",
      "title": "Consent rule (opt-in)",
      "description": "Each participant: every participant present replies with consent. Owner attests: the meeting's owner confirms that everyone agreed, for example out loud or in the invitation's terms.",
      "enum": ["each_participant", "owner_attests"],
      "enumLabels": {
        "each_participant": "Each participant consents",
        "owner_attests": "The meeting owner attests that everyone agreed"
      },
      "dependsOn": { "field": "mode", "value": "opt_in" }
    },
    "notifyNoticeText": {
      "order": 2,
      "type": "string",
      "title": "Notice text (notify)",
      "description": "Posted when a notify meeting starts. {LMA_USER} is the person using LMA, {meeting} the meeting's name, and {consent_phrase} and {objection_phrase} the first phrase of each list below.",
      "format": "textarea",
      "rows": 3,
      "minLength": 1,
      "maxLength": 2000,
      "dependsOn": { "field": "mode", "value": "notify" }
    },
    "optInNoticeText": {
      "order": 3,
      "type": "string",
      "title": "Consent request text (opt-in)",
      "description": "Posted when an opt-in meeting starts. The same placeholders as the notice text.",
      "format": "textarea",
      "rows": 3,
      "minLength": 1,
      "maxLength": 2000,
      "dependsOn": { "field": "mode", "value": "opt_in" }
    },
    "consentPhrases": {
      "order": 4,
      "type": "string",
      "title": "Consent phrases",
      "description": "Comma-separated. A reply containing one of these, as whole words and ignoring case and punctuation, is read as consent, unless it also contains an objection phrase.",
      "minLength": 1,
      "maxLength": 1000
    },
    "objectionPhrases": {
      "order": 5,
      "type": "string",
      "title": "Objection phrases",
      "description": "Comma-separated. A reply containing one of these is read as an objection. Objections are looked for first, so \"I do not consent\" is an objection although it contains \"consent\".",
      "minLength": 1,
      "maxLength": 1000
    },
    "allowPerMeetingOverride": {
      "order": 6,
      "type": "boolean",
      "title": "Allow a different choice per meeting",
      "description": "On: whoever starts a meeting may choose another mode or rule for it. Off: a meeting may only use this mode and rule or a stricter one."
    }
  },
  "additionalProperties": false
}
